### ISSUE TITLE
UPD packets dropped, MTU 1500, Don't Fragment (DF) Bit is set to 1

### ISSUE THREAD

**Issue by glumb** [iotaledger/iri#276]
I am having some issues sending and receiving UDP packets for my iri node. (TCP is working fine)
Inspecting the network shows:
```
tcpdump  -nn port 14600
tcpdump: verbose output suppressed, use -v or -vv for full protocol decode
listening on venet0, link-type LINUX_SLL (Linux cooked), capture size 262144 bytes
14:59:30.629081 IP SOURCE.14600 > IP: UDP, length 1650
14:59:30.629138 IP SOURCE.14600 > IP: UDP, length 1650
14:59:30.629162 IP SOURCE.14600 > IP: UDP, length 1650
```
that UDP the package size is 1650 
as specified in https://github.com/iotaledger/iri/blob/9d4abe2d59d336c0ecec1f826554bc2c1f29d278/src/main/java/com/iota/iri/network/Node.java#L47

![bildschirmfoto 2017-08-24 um 18 02 05](https://user-images.githubusercontent.com/3062564/29675883-ca51198a-88f6-11e7-9980-aaa793e05842.png)

Inspecting the packet shows, that the "Don't Fragment (DF)" Bit is set to 1. In my understanding this results in all packets greater than the MTU being dropped. 

1500/1472 seems to be a reasonable safe value for the max package size, as many devices use a MTU 1500. Why was 1650 chosen? Allowing fragmentation by setting DF to 0 would also be possible, but I'm not sure where this bit is set.

**Comment by alon-e** [comment]
are you looking at an outgoing packet? (the screenshot)
if so, you won't see the fragmentation, it happens on lower levels - NIC/kernel.

>Why was 1650 chosen? 
b/c this is the size of a `transaction + hash(request_tx)` represented in bytes (1604 + 46).

fragmentation is taken care of in the IP layer (+ reassembling).
a nice experiment is to connect 2 IRI nodes on the same local network & analyze the traffic in wireshark.
(for example some windows machines fragment this into 3 packets!)

afaik, you don't have control over fragmentation settings from user-space.

btw, Google Cloud Platform is notoriously bad w/ UDP fragmentation.

**Comment by glumb** [comment]
Yes, I am looking at the outgoing packet. 
But since the DF bit is set, I assume that no fragmentation happens? I can confirm that outgoing and incoming packets > 1500 are dropped. So there must be a gateway only accepting MTU <= 1500.

There seems to be a way to control the DF using `int setsockopt( int s, int level, int optname,          const void *optval, socklen_t optlen );` but its not crossplattform, nor available in Java.

I see that the packet size can not be changed.

Are there any drawbacks using TCP, besides some overhead?

**Comment by alon-e** [comment]
>Are there any drawbacks using TCP, besides some overhead?
not for regular computers.
TCP in practice is much better for PCs, faster syncing & lower bandwidth (due to less lost packets & congestion control).
UDP is important for "simple" computer that don't have a good TCP stack impl. or nodes that need UDP specificly.

**Comment by viossat** [comment]
From my experience, if your network interface does not support UDP Fragmentation Offload, UDP packets will be dropped in one way and the tethered connection will never be established.
This is due because the UDP packet's length of the IRI, 1650 bytes, is longer than the standard MTU, 1500 bytes.
To know if your interface supports the feature, you can use `ethtool`: `ethtool -k ethX | grep udp-fragmentation-offload`

**Comment by glumb** [comment]
I switched the datacenter. Now:
```
max@iota:~/iota$ ethtool -k ens3 | grep udp-fragmentation-offload
udp-fragmentation-offload: on
```
but still outgoing TX raise an tcpdump error:
```
22:31:09.962276 IP me.14600 > other.14600: UDP, length 1650
22:31:09.962504 IP other.14600 > me.14600: UDP, bad length 1650 > 1472
```
So I don't see any incoming transactions.

**Comment by flqw** [comment]
I had the same issue with running the iri in docker. The docker0 bridge seems to drop fragmented udp packets. I only have found a workaround by running the container directly with the host network with (--network=host).

Btw: tcpdump always shows the bad length message if an udp packet is longer than the mtu, even if the system is working.

**Comment by grittibaenz** [comment]
I can confirm the findings by @flqw. Syncing works with `--network=host` but doesn't with `--network=bridge`.

**Comment by nuriel77** [comment]
@grittibaenz with which version of IRI are you experiencing this with?

**Comment by grittibaenz** [comment]
@nuriel77: version `1.5.6`, which has been released a couple of days ago. I am struggling with synchronization issues for months and finally found some time to investigate again. We peer with nodes from the IOTA foundation, but still have sync issues. Docker/UDP seems to be one piece of the puzzle.
